{
  "schemaVersion": "practice-topik35-listening-transcript-payload-v1",
  "packageId": "topik35-v1-listening-transcript-payload-v1",
  "bundleId": "topik35-v1",
  "capturedAt": "2026-08-03",
  "status": "TRANSCRIPT_QA_COMPLETE_LOAD_BLOCKED",
  "languageTag": "ko",
  "sourceBinding": {
    "artifactId": "topik35-listening-transcript-pdf",
    "logicalKey": "practice-seed/topik35-v1/source/document/25caa51ee044b020f84b75fae2f64b5d95fbb35ebef07f58d5d8fc9186df3922.pdf",
    "sha256": "25caa51ee044b020f84b75fae2f64b5d95fbb35ebef07f58d5d8fc9186df3922",
    "pageFrom": 1,
    "pageTo": 26,
    "displayedIdentity": "제35회 한국어능력시험 II B형 (듣기 통합)"
  },
  "crossCheck": {
    "questionPayloadSchemaVersion": "practice-topik35-listening-question-payload-v1",
    "questionPayloadPackageId": "topik35-v1-listening-question-payload-v1",
    "questionPayloadProjectionSha256": "52249b9398f8950e948b7d449d0d1391f493e9113aaffa78e9ab8818e604df1f",
    "importPackageSchemaVersion": "practice-topik35-listening-import-package-v1",
    "importPackageId": "topik35-v1-listening-v1"
  },
  "materializationPolicy": {
    "sourceRole": "AUTHORITATIVE_OFFICIAL_TRANSCRIPT_PDF",
    "method": "MANUAL_VISUAL_QA_WITH_TEXT_EXTRACTION_AS_INDEX_ONLY",
    "captionUsed": false,
    "audioUsedForText": false,
    "timestampsDerived": false,
    "questionOrAnswerTextIncluded": false
  },
  "groups": [
    {
      "groupId": "L01_03",
      "displayOrder": 1,
      "questionFrom": 1,
      "questionTo": 3,
      "sourcePdfPages": [1, 2, 3],
      "stimulus": {
        "schemaVersion": "practice-stimulus-v2",
        "type": "LISTENING_AUDIO",
        "instruction": "다음을 듣고 알맞은 그림을 고르십시오.",
        "passageText": "",
        "transcriptText": "1. 여자: 이거 좀 봐 주실래요? 옷에 커피를 쏟았어요.\n남자: 어디 좀 볼까요? 음……, 세탁하면 깨끗해질 거예요. 언제까지 해 드리면 돼요?\n여자: 내일까지 해 주세요.\n\n2. 여자: 그동안 답답했는데 높은 데 올라오니까 좋네요.\n남자: 그렇죠? 그래서 저는 등산이 좋아요. 이렇게 정상에서 멀리 바라보고 있으면 마음이 편해져요.\n여자: 맞아요. 우리 이제 자주 와요.\n\n3. 남자: 스마트폰 사용자가 많아지면서 모바일 쇼핑 이용객이 급격히 증가한 것으로 나타났습니다. 20대가 가장 많이 이용하는 것으로 나타났으며 10대가 그 뒤를 이었습니다. 여전히 컴퓨터로 쇼핑을 하는 사람들이 많지만 앞으로 모바일 쇼핑 이용객이 더 늘 것으로 예상됩니다.",
        "mediaReference": null,
        "sourceRefs": [
          {"kind": "PAGE", "sourceId": "topik35-listening-transcript-pdf", "pageNumber": 1},
          {"kind": "PAGE", "sourceId": "topik35-listening-transcript-pdf", "pageNumber": 2},
          {"kind": "PAGE", "sourceId": "topik35-listening-transcript-pdf", "pageNumber": 3}
        ]
      },
      "transcriptQaStatus": "VISUALLY_VERIFIED",
      "timingStatus": "PENDING_MANUAL_AUDIO_QA",
      "startMs": null,
      "endMs": null
    },
    {
      "groupId": "L04_08",
      "displayOrder": 2,
      "questionFrom": 4,
      "questionTo": 8,
      "sourcePdfPages": [4, 5],
      "stimulus": {
        "schemaVersion": "practice-stimulus-v2",
        "type": "LISTENING_AUDIO",
        "instruction": "다음 대화를 잘 듣고 이어질 수 있는 말을 고르십시오.",
        "passageText": "",
        "transcriptText": "4. 남자: 사장님, 제가 감기 때문에 오늘은 못 나갈 것 같아요. 죄송합니다.\n여자: 괜찮아요. 그런데 병원에 갔다 왔어요? 다른 사람들도 많이 있으니까 걱정하지 말고 푹 쉬어요.\n남자: _________________________________________________\n\n5. 남자: 어서 오십시오, 손님. 어디로 모실까요?\n여자: 서울역요. 그런데 아저씨, 7시까지 도착할 수 있을까요? 제가 기차를 타야 해서요.\n남자: _________________________________________________\n\n6. 여자: 요즘 집에서 만들어 먹는 음료수가 인기래요. 만드는 법도 간단하고 쉬워서 많이 만든대요.\n남자: 직접 만드니까 파는 것보다 건강에 좋겠네요.\n여자: _________________________________________________\n\n7. 여자: 거실이 너무 넓어서 허전해 보였는데 이렇게 화분을 몇 개 놓으니까 훨씬 좋지?\n남자: 응, 그렇기는 한데 문 옆에 커다란 화분이 있으면 좀 불편할 것 같아.\n여자: _________________________________________________\n\n8. 여자: 저, 갑자기 비가 와서 그러는데 요즘도 우산 빌려 주세요?\n남자: 어쩌죠? 우산 대여 서비스가 지난달부터 중단되었습니다. 우산을 반납하는 분들이 너무 적어서 서비스를 계속하기가 힘들어서요.\n여자: _________________________________________________",
        "mediaReference": null,
        "sourceRefs": [
          {"kind": "PAGE", "sourceId": "topik35-listening-transcript-pdf", "pageNumber": 4},
          {"kind": "PAGE", "sourceId": "topik35-listening-transcript-pdf", "pageNumber": 5}
        ]
      },
      "transcriptQaStatus": "VISUALLY_VERIFIED",
      "timingStatus": "PENDING_MANUAL_AUDIO_QA",
      "startMs": null,
      "endMs": null
    },
    {
      "groupId": "L09_12",
      "displayOrder": 3,
      "questionFrom": 9,
      "questionTo": 12,
      "sourcePdfPages": [6, 7],
      "stimulus": {
        "schemaVersion": "practice-stimulus-v2",
        "type": "LISTENING_AUDIO",
        "instruction": "다음 대화를 잘 듣고 여자가 이어서 할 행동으로 알맞은 것을 고르십시오.",
        "passageText": "",
        "transcriptText": "9. 여자: 중고 가게에서 가구를 사 가기도 한다면서? 침대를 팔까 하는데 어떻게 하면 돼?\n남자: 먼저 침대 사진을 찍어서 가게 홈페이지에 올리고 어느 회사 제품인지도 써 놔. 그럼 가게에서 연락이 올 거야.\n여자: 그러면 침대는 내가 갖다 줘야 돼?\n남자: 아니, 가게에서 사람들이 와서 가져갈 거야.\n\n10. 여자: 팀장님, 복사기를 새로 사야 할 것 같은데요.\n남자: 왜요? 고칠 수 없대요?\n여자: 네, 복사기가 너무 오래돼서 고치는 데 비용이 많이 들 것 같다고 합니다. 구매팀에 얘기해서 새것으로 사는 게 어떨까요?\n남자: 그렇게 해요. 그럼 김 대리가 자세한 상황을 알려 주도록 하세요.\n\n11. 여자: 민수 씨, 이번에 인문학 강의 들을 거예요?\n남자: 저는 작년에 들었어요. 그 강의 인기가 많으니까 빨리 신청해야 할 거예요.\n여자: 아, 네. 그럼 서둘러야겠네요. 그런데 교재는 뭐예요? 홈페이지에 나와 있지 않더라고요.\n남자: 그래요? 저한테 그 책이 있으니까 내일 갖다 줄게요.\n\n12. 남자: 강 선생님, 이번 현장학습은 어디로 가면 좋을까요?\n여자: 음……, 안전 교육 체험관이 어때요? 지진과 같은 자연재해를 체험해 보면 학생들한테도 유익할 거예요.\n남자: 그게 좋겠네요. 구체적으로 어떤 프로그램이 있는지 알아봐야겠어요. 위치도 알아보고요.\n여자: 위치는 제가 알아봐 드릴게요.\n남자: 정말요? 고마워요, 강 선생님. 그럼 저는 자세한 일정을 짜야겠어요.",
        "mediaReference": null,
        "sourceRefs": [
          {"kind": "PAGE", "sourceId": "topik35-listening-transcript-pdf", "pageNumber": 6},
          {"kind": "PAGE", "sourceId": "topik35-listening-transcript-pdf", "pageNumber": 7}
        ]
      },
      "transcriptQaStatus": "VISUALLY_VERIFIED",
      "timingStatus": "PENDING_MANUAL_AUDIO_QA",
      "startMs": null,
      "endMs": null
    },
    {
      "groupId": "L13_16",
      "displayOrder": 4,
      "questionFrom": 13,
      "questionTo": 16,
      "sourcePdfPages": [8, 9],
      "stimulus": {
        "schemaVersion": "practice-stimulus-v2",
        "type": "LISTENING_AUDIO",
        "instruction": "다음을 듣고 내용과 일치하는 것을 고르십시오.",
        "passageText": "",
        "transcriptText": "13. 여자: 해외 온라인 쇼핑몰에서 물건을 사면 싸다면서?\n남자: 응. 시간은 좀 오래 걸리는데 훨씬 더 싸. 국내에서 구할 수 없는 물건도 살 수 있고.\n여자: 주문하기 복잡하지 않아? 나도 한번 해 볼까 하는데.\n남자: 별로 안 어렵던데. 세일하면 더 싸지니까 세일 기간도 잘 알아보고 해\n\n14. 여자: 안내 말씀 드리겠습니다. 잠시 후 4시부터 7시까지 영화 촬영이 진행될 예정입니다. 동문 주차장에 차를 세우신 분들은 공원 내 다른 주차장으로 이동시켜 주시기 바랍니다. 영화를 찍는 동안 사진 촬영은 금지되어 있으니 협조해 주시기 바랍니다.\n\n15. 남자: 다음은 작년 말 인기를 끌었던 앙코르 발레 공연 소식입니다. 이 공연은 한 예술고등학교 교사들로 이루어진 무용단이 어린이들을 위해 준비한 발레인데요. 어린이들이 재미있게 볼 수 있도록 무용수들이 동물 복장을 하고 나와 춤을 춥니다. 여기에 노래도 더해져 아이들의 이해를 돕고 있습니다. 휴일 나들이로 온 가족이 함께 관람하시는 것도 좋을 것 같습니다.\n\n16. 여자: 오늘은 기차가 다니지 않는 기차역, 송정역에 나와 있습니다. 역장님, 이곳을 좀 소개해 주시죠.\n남자: 이곳은 10년 전부터 기차를 운행하지 않는 곳입니다. 그래서 그동안 역사를 사용하지 않고 있었는데요. 최근 한 주민의 제안으로 기차역과 열차를 옛날 열차 분위기의 카페로 만들었습니다. 지역 주민들의 반응도 좋고 이곳을 방문했던 손님들의 입소문을 듣고 찾아오는 관광객이 많아졌습니다.",
        "mediaReference": null,
        "sourceRefs": [
          {"kind": "PAGE", "sourceId": "topik35-listening-transcript-pdf", "pageNumber": 8},
          {"kind": "PAGE", "sourceId": "topik35-listening-transcript-pdf", "pageNumber": 9}
        ]
      },
      "transcriptQaStatus": "VISUALLY_VERIFIED",
      "timingStatus": "PENDING_MANUAL_AUDIO_QA",
      "startMs": null,
      "endMs": null
    },
    {
      "groupId": "L17_20",
      "displayOrder": 5,
      "questionFrom": 17,
      "questionTo": 20,
      "sourcePdfPages": [10, 11],
      "stimulus": {
        "schemaVersion": "practice-stimulus-v2",
        "type": "LISTENING_AUDIO",
        "instruction": "다음을 듣고 남자의 중심 생각을 고르십시오.",
        "passageText": "",
        "transcriptText": "17. 남자: 현아 씨가 직장을 그만두고 1년 계획으로 세계여행을 간대요. 정말 대단한 것 같아요.\n여자: 저도 들었어요. 그런데 직장까지 그만두고 여행을 간다는 게 좀 이해가 안돼요. 회사에 다니면서도 여행은 할 수 있을 텐데.\n남자: 길게는 못 가잖아요. 쉬면서 자기 자신도 돌아보고 새로운 계획도 세울 수 있으니까 한번쯤 장기 여행을 가는 건 좋은 것 같아요.\n\n18. 남자: 그럼 운동은 다음 주 월요일부터 시작하시는 걸로 알고 있겠습니다. 더 궁금한 건 없으세요?\n여자: 제가 일주일에 세 번 정도밖에 못 올 것 같은데요. 그 정도로도 운동 효과를 볼 수 있을까요?\n남자: 그럼요. 세 번 정도 하시면 충분합니다. 운동은 많이 한다고 좋은 게 아니거든요. 너무 심하게 운동하면 몸이 스트레스를 받아서 건강에 더 안 좋습니다. 무리하지 말고 적당히 하는 게 좋죠.\n\n19. 남자: 연예인이 자기 아이들과 함께 텔레비전에 나오는 경우가 많네요.\n여자: 그러게요. 그런데 아이들한테 부작용은 없을까요?\n남자: 혼자 출연하는 게 아니라 부모님과 함께 나오니까 걱정할 일은 없을 것 같은데요. 무엇보다 아이들의 재능을 일찍 발견할 수 있어서 좋을 것 같고요.\n여자: 학교에 다녀야 할 나이인데 방송 때문에 공부할 시간이 없잖아요.\n\n20. 여자: 김영재 선생님은 전통 그대로의 한복만 만드시는 걸로 유명한데요. 특별한 이유가 있나요?\n남자: 전 한복의 대중화보다는 전통 한복의 아름다움을 지키는 게 중요하다고 봅니다. 현대 한복은 화려한 색과 실용적인 디자인으로 한복을 대중화하는 데 기여했지요. 하지만 한복의 가장 중요한 요소는 과하지 않은 색과 선입니다. 이런 고유의 특징이 빠진다면 진짜 한복이 아닌 거죠.",
        "mediaReference": null,
        "sourceRefs": [
          {"kind": "PAGE", "sourceId": "topik35-listening-transcript-pdf", "pageNumber": 10},
          {"kind": "PAGE", "sourceId": "topik35-listening-transcript-pdf", "pageNumber": 11}
        ]
      },
      "transcriptQaStatus": "VISUALLY_VERIFIED",
      "timingStatus": "PENDING_MANUAL_AUDIO_QA",
      "startMs": null,
      "endMs": null
    },
    {
      "groupId": "L21_22",
      "displayOrder": 6,
      "questionFrom": 21,
      "questionTo": 22,
      "sourcePdfPages": [12],
      "stimulus": {
        "schemaVersion": "practice-stimulus-v2",
        "type": "LISTENING_AUDIO",
        "instruction": "다음을 듣고 물음에 답하십시오.",
        "passageText": "",
        "transcriptText": "여자: 기숙사 신청 날짜를 착각해서 신청을 못했는데 어쩌지?\n남자: 학교에서 소개해 주는 집이 있는데 신청해 볼래? 다른 학생들하고 보증금을 나눠 내고 집을 같이 빌리는 방식이라서 보증금 부담도 적은데.\n여자: 그럼 집을 같이 쓰는 거네? 한집에서 공동생활 하는 건 좀 불편할 것 같은데. 아무래도 서로 신경 쓸 일도 많을 거고.\n남자: 공동생활도 생각보다 괜찮아. 방은 혼자 쓰니까 개인 공간도 있고. 부엌이나 거실 같은 공용 공간은 같이 관리하니까 혼자일 때보다 오히려 편해. 서로 의지가 되니까 외로움도 덜하고.",
        "mediaReference": null,
        "sourceRefs": [{"kind": "PAGE", "sourceId": "topik35-listening-transcript-pdf", "pageNumber": 12}]
      },
      "transcriptQaStatus": "VISUALLY_VERIFIED",
      "timingStatus": "PENDING_MANUAL_AUDIO_QA",
      "startMs": null,
      "endMs": null
    },
    {
      "groupId": "L23_24",
      "displayOrder": 7,
      "questionFrom": 23,
      "questionTo": 24,
      "sourcePdfPages": [13],
      "stimulus": {
        "schemaVersion": "practice-stimulus-v2",
        "type": "LISTENING_AUDIO",
        "instruction": "다음을 듣고 물음에 답하십시오.",